{
  "$schema": "../../../schemas/metadata-catalog.schema.json",
  "companyId": "bavans-publishing",
  "description": "Protocol references for BAVANS Publishing company",
  "entries": {
    "accessibility-gate-protocol": "protocols/accessibility-gate-protocol.yaml",
    "agent-performance-review-protocol": "protocols/agent-performance-review-protocol.yaml",
    "api-spend-guardrail-protocol": "protocols/api-spend-guardrail-protocol.yaml",
    "audit-trail-integrity-protocol": "protocols/audit-trail-integrity-protocol.yaml",
    "brand-consistency-audit-protocol": "protocols/brand-consistency-audit-protocol.yaml",
    "capital-allocation-handshake-protocol": "protocols/capital-allocation-handshake-protocol.yaml",
    "capital-allocation-protocol": "protocols/capital-allocation-protocol.yaml",
    "clean-architecture-gate-protocol": "protocols/clean-architecture-gate-protocol.yaml",
    "clear-desk-protocol": "protocols/clear-desk-protocol.md",
    "communication-style": "protocols/communication-style.yaml",
    "company-non-negotiables-protocol": "protocols/company-non-negotiables-protocol.md",
    "competency-calibration-protocol": "protocols/competency-calibration-protocol.yaml",
    "complexity-based-escalation-protocol": "protocols/complexity-based-escalation-protocol.yaml",
    "compliance-gate-protocol": "protocols/compliance-gate-protocol.yaml",
    "conflict-escalation-protocol": "protocols/conflict-escalation-protocol.yaml",
    "conflict-resolution-protocol": "protocols/conflict-resolution-protocol.yaml",
    "context-injection-protocol": "protocols/context-injection-protocol.yaml",
    "crisis-fiscal-freeze-protocol": "protocols/crisis-fiscal-freeze-protocol.yaml",
    "crisis-lockdown-protocol": "protocols/crisis-lockdown-protocol.yaml",
    "database-schema-governance-protocol": "protocols/database-schema-governance-protocol.yaml",
    "design-to-code-handoff-protocol": "protocols/design-to-code-handoff-protocol.yaml",
    "deterministic-handoff-protocol": "protocols/deterministic-handoff-protocol.yaml",
    "director-inquiry-escalation-protocol": "protocols/director-inquiry-escalation-protocol.yaml",
    "due-diligence-automation-protocol": "protocols/due-diligence-automation-protocol.yaml",
    "ephemeral-analytics-generation-protocol": "protocols/ephemeral-analytics-generation-protocol.yaml",
    "ephemeral-report-generation-protocol": "protocols/ephemeral-report-generation-protocol.yaml",
    "equity-governance-protocol": "protocols/equity-governance-protocol.yaml",
    "error-reporting-standard": "protocols/error-reporting-standard.yaml",
    "external-channel-communication-protocol": "protocols/external-channel-communication-protocol.yaml",
    "friction-resolution-protocol": "protocols/friction-resolution-protocol.yaml",
    "git-commit-integrity-protocol": "protocols/git-commit-integrity-protocol.yaml",
    "git-governance-handshake-protocol": "protocols/git-governance-handshake-protocol.yaml",
    "google-ecosystem-ingestion-protocol": "protocols/google-ecosystem-ingestion-protocol.yaml",
    "handoff-validation-protocol": "protocols/handoff-validation-protocol.yaml",
    "human-review-required-protocol": "protocols/human-review-required-protocol.md",
    "incident-escalation-protocol": "protocols/incident-escalation-protocol.yaml",
    "intent-parsing-protocol": "protocols/intent-parsing-protocol.yaml",
    "interaction-consistency-audit-protocol": "protocols/interaction-consistency-audit-protocol.yaml",
    "inter-agent-communication-protocol-gicp-1": "protocols/inter-agent-communication-protocol-gicp-1.yaml",
    "internal-memo-rfi-protocol": "protocols/internal-memo-rfi-protocol.yaml",
    "investor-readiness-protocol": "protocols/investor-readiness-protocol.yaml",
    "launch-sequencing-protocol": "protocols/launch-sequencing-protocol.yaml",
    "mandatory-persona-documentation-protocol": "protocols/mandatory-persona-documentation-protocol.md",
    "narrative-integrity-protocol": "protocols/narrative-integrity-protocol.yaml",
    "nemoclaw-navigation-automation-guard-protocol": "protocols/nemoclaw-navigation-automation-guard-protocol.yaml",
    "onboarding-sequencing-protocol": "protocols/onboarding-sequencing-protocol.yaml",
    "operational-integrity-protocol": "protocols/operational-integrity-protocol.yaml",
    "privacy-by-design-protocol": "protocols/privacy-by-design-protocol.yaml",
    "product-track-separation-protocol": "protocols/product-track-separation-protocol.md",
    "queue-prioritization-protocol": "protocols/queue-prioritization-protocol.yaml",
    "self-healing-budget-protocol": "protocols/self-healing-budget-protocol.yaml",
    "self-healing-codebase-protocol": "protocols/self-healing-codebase-protocol.yaml",
    "self-healing-goose-protocol": "protocols/self-healing-goose-protocol.yaml",
    "self-healing-narrative-protocol": "protocols/self-healing-narrative-protocol.yaml",
    "self-healing-role-protocol": "protocols/self-healing-role-protocol.yaml",
    "self-healing-routing-protocol": "protocols/self-healing-routing-protocol.yaml",
    "self-healing-ux-protocol": "protocols/self-healing-ux-protocol.yaml",
    "stability-mode-governance-protocol": "protocols/stability-mode-governance-protocol.yaml",
    "technical-debt-threshold-protocol": "protocols/technical-debt-threshold-protocol.yaml",
    "vault-access-tiering-protocol": "protocols/vault-access-tiering-protocol.yaml",
    "visual-token-governance-protocol": "protocols/visual-token-governance-protocol.yaml",
    "voice-identity-consent-protocol": "protocols/voice-identity-consent-protocol.md"
  },
  "updatedAt": "2026-04-08T00:00:00.000Z"
}
