{
  "$schema": "../../../schemas/metadata-catalog.schema.json",
  "companyId": "bavans-publishing",
  "description": "KPI references for BAVANS Publishing company",
  "entries": {
    "accessibility-conformance-rate": "kpis/accessibility-conformance-rate.json",
    "activation-velocity": "kpis/activation-velocity.json",
    "architectural-debt-ratio": "kpis/architectural-debt-ratio.json",
    "audit-trail-completeness-score": "kpis/audit-trail-completeness-score.json",
    "autonomous-bug-resolution-rate": "kpis/autonomous-bug-resolution-rate.json",
    "autonomous-handoff-resolution-rate": "kpis/autonomous-handoff-resolution-rate.json",
    "autonomous-recovery-rate": "kpis/autonomous-recovery-rate.json",
    "autonomous-report-accuracy": "kpis/autonomous-report-accuracy.json",
    "autonomous-resolution-rate": "kpis/autonomous-resolution-rate.json",
    "bavans-value-gate-pass-rate": "kpis/bavans-value-gate-pass-rate.json",
    "brand-conversion-correlation": "kpis/brand-conversion-correlation.json",
    "burn-variance-ratio": "kpis/burn-variance-ratio.json",
    "calibration-drift-rate": "kpis/calibration-drift-rate.json",
    "change-lead-time": "kpis/change-lead-time.json",
    "codebase-compliance-score": "kpis/codebase-compliance-score.json",
    "compliance-friction-delta": "kpis/compliance-friction-delta.json",
    "compliance-pass-rate": "kpis/compliance-pass-rate.json",
    "context-loss-rate": "kpis/context-loss-rate.json",
    "control-pass-rate": "kpis/control-pass-rate.json",
    "crisis-recovery-speed": "kpis/crisis-recovery-speed.json",
    "cross-functional-alignment-index": "kpis/cross-functional-alignment-index.json",
    "cross-role-resolution-time": "kpis/cross-role-resolution-time.json",
    "data-leakage-events": "kpis/data-leakage-events.json",
    "decision-cycle-time": "kpis/decision-cycle-time.json",
    "deployment-success-rate": "kpis/deployment-success-rate.json",
    "design-debt-ratio": "kpis/design-debt-ratio.json",
    "evidence-fidelity-score": "kpis/evidence-fidelity-score.json",
    "funding-cost-efficiency": "kpis/funding-cost-efficiency.json",
    "governance-velocity-delta": "kpis/governance-velocity-delta.json",
    "governance-velocity": "kpis/governance-velocity.json",
    "handoff-rejection-rate": "kpis/handoff-rejection-rate.json",
    "handshake-success-rate": "kpis/handshake-success-rate.json",
    "hiring-cycle-time": "kpis/hiring-cycle-time.json",
    "human-review-gate-pass-rate": "kpis/human-review-gate-pass-rate.json",
    "idea-origin-traceability-rate": "kpis/idea-origin-traceability-rate.json",
    "interaction-friction-delta": "kpis/interaction-friction-delta.json",
    "investor-sentiment-index": "kpis/investor-sentiment-index.json",
    "investor-stage-conversion": "kpis/investor-stage-conversion.json",
    "ipc-round-trip-latency": "kpis/ipc-round-trip-latency.json",
    "launch-to-liquidity-delta": "kpis/launch-to-liquidity-delta.json",
    "narrative-fidelity-score": "kpis/narrative-fidelity-score.json",
    "policy-alignment-index": "kpis/policy-alignment-index.json",
    "product-track-separation-violation-count": "kpis/product-track-separation-violation-count.json",
    "qualified-pipeline-coverage": "kpis/qualified-pipeline-coverage.json",
    "queue-throughput-velocity": "kpis/queue-throughput-velocity.json",
    "retention-signal": "kpis/retention-signal.json",
    "role-fit-accuracy": "kpis/role-fit-accuracy.json",
    "routing-accuracy-score": "kpis/routing-accuracy-score.json",
    "runway-coverage-months": "kpis/runway-coverage-months.json",
    "sla-breach-count": "kpis/sla-breach-count.json",
    "strategic-milestone-attainment": "kpis/strategic-milestone-attainment.json",
    "strategic-milestone-attainment-rate": "kpis/strategic-milestone-attainment-rate.json",
    "system-uptime-and-latency": "kpis/system-uptime-and-latency.json",
    "token-compliance-rate": "kpis/token-compliance-rate.json",
    "token-compliance-score": "kpis/token-compliance-score.json"
  },
  "updatedAt": "2026-04-08T00:00:00.000Z"
}
