{
  "$schema": "../../../schemas/metadata-catalog.schema.json",
  "companyId": "bavans-publishing",
  "description": "Skill references for BAVANS Publishing company",
  "entries": {
    "accessibility-compliance-logic": "skills/accessibility-compliance-logic.md",
    "automated-policy-validation": "skills/automated-policy-validation.md",
    "automated-unit-testing-logic": "skills/automated-unit-testing-logic.md",
    "autonomous-priority-rebalancing": "skills/autonomous-priority-rebalancing.md",
    "bavans-audio-first-distribution-orchestration": "skills/bavans-audio-first-distribution-orchestration.md",
    "bavans-education-track-governance": "skills/bavans-education-track-governance.md",
    "bavans-feature-onboarding-and-track-separation": "skills/bavans-feature-onboarding-and-track-separation.md",
    "bavans-value-boundary-enforcement": "skills/bavans-value-boundary-enforcement.md",
    "behavioral-alignment-audit": "skills/behavioral-alignment-audit.md",
    "bottleneck-diagnostic-logic": "skills/bottleneck-diagnostic-logic.md",
    "brand-identity-audit": "skills/brand-identity-audit.md",
    "budget-allocation": "skills/budget-allocation.md",
    "campaign-architecture": "skills/campaign-architecture.md",
    "channel-communication-orchestration": "skills/channel-communication-orchestration.md",
    "clean-architecture-enforcement": "skills/clean-architecture-enforcement.md",
    "code-forensics": "skills/code-forensics.md",
    "command-decomposition-logic": "skills/command-decomposition-logic.md",
    "competency-mapping-logic": "skills/competency-mapping-logic.md",
    "contextual-intent-mapping": "skills/contextual-intent-mapping.md",
    "crisis-impact-simulation": "skills/crisis-impact-simulation.md",
    "cross-module-cohesion": "skills/cross-module-cohesion.md",
    "design-system-orchestration": "skills/design-system-orchestration.md",
    "drift-detection-logic": "skills/drift-detection-logic.md",
    "email-triage-classifier": "skills/email-triage-classifier.md",
    "execution-governance": "skills/execution-governance.md",
    "financial-forecasting": "skills/financial-forecasting.md",
    "funnel-diagnostic-logic": "skills/funnel-diagnostic-logic.md",
    "git-orchestration": "skills/git-orchestration.md",
    "git-transaction-scaffolding": "skills/git-transaction-scaffolding.md",
    "go-to-market-orchestration": "skills/go-to-market-orchestration.md",
    "governance-enforcement": "skills/governance-enforcement.md",
    "handoff-integrity-audit": "skills/handoff-integrity-audit.md",
    "handoff-integrity": "skills/handoff-integrity.md",
    "idea-origin-attribution-tracking": "skills/idea-origin-attribution-tracking.md",
    "incident-forensics": "skills/incident-forensics.md",
    "interaction-quality-mapping": "skills/interaction-quality-mapping.md",
    "investor-pipeline-prioritization": "skills/investor-pipeline-prioritization.md",
    "latency-optimization-strategy": "skills/latency-optimization-strategy.md",
    "market-narrative-design": "skills/market-narrative-design.md",
    "milestone-decomposition": "skills/milestone-decomposition.md",
    "multi-agent-sync-orchestration": "skills/multi-agent-sync-orchestration.md",
    "narrative-fidelity-mapping": "skills/narrative-fidelity-mapping.md",
    "non-dilutive-capital-strategy": "skills/non-dilutive-capital-strategy.md",
    "openclaw-feature-extraction-parameters": "skills/openclaw-feature-extraction-parameters.md",
    "organizational-design-strategy": "skills/organizational-design-strategy.md",
    "pii-detection-logic": "skills/pii-detection-logic.md",
    "queue-health-management": "skills/queue-health-management.md",
    "regulatory-mapping": "skills/regulatory-mapping.md",
    "risk-disclosure-mapping": "skills/risk-disclosure-mapping.md",
    "routing-precision": "skills/routing-precision.md",
    "schema-design-and-migration": "skills/schema-design-and-migration.md",
    "secretary-global-router": "skills/secretary-global-router.md",
    "security-audit": "skills/security-audit.md",
    "self-healing-code-recovery": "skills/self-healing-code-recovery.md",
    "self-healing-compliance-correction": "skills/self-healing-compliance-correction.md",
    "self-healing-copy-optimization": "skills/self-healing-copy-optimization.md",
    "self-healing-handoff-recovery": "skills/self-healing-handoff-recovery.md",
    "self-healing-orchestration": "skills/self-healing-orchestration.md",
    "self-healing-persona-correction": "skills/self-healing-persona-correction.md",
    "self-healing-pitch-optimization": "skills/self-healing-pitch-optimization.md",
    "self-healing-ui-correction": "skills/self-healing-ui-correction.md",
    "self-healing-workflow-recovery": "skills/self-healing-workflow-recovery.md",
    "sentiment-trend-forecasting": "skills/sentiment-trend-forecasting.md",
    "spam-newsletter-filter": "skills/spam-newsletter-filter.md",
    "strategic-alignment": "skills/strategic-alignment.md",
    "talent-evaluation": "skills/talent-evaluation.md",
    "throughput-predictability-modeling": "skills/throughput-predictability-modeling.md",
    "traction-evidence-synthesis": "skills/traction-evidence-synthesis.md",
    "usability-evidence-synthesis": "skills/usability-evidence-synthesis.md",
    "visual-audit": "skills/visual-audit.md"
  },
  "updatedAt": "2026-04-08T00:00:00.000Z"
}
