{
  "$schema": "../../../schemas/metadata-catalog.schema.json",
  "companyId": "bavans-publishing",
  "description": "Data input references for BAVANS Publishing company",
  "entries": {
    "accessibility-audit-logs": "data-inputs/accessibility-audit-logs.json",
    "accessibility-policy-json": "data-inputs/accessibility-policy-json.json",
    "accessibility-policy-md": "data-inputs/accessibility-policy-md.json",
    "agent-directory-registry": "data-inputs/agent-directory-registry.json",
    "agent-performance-data": "data-inputs/agent-performance-data.json",
    "agent-performance-telemetry": "data-inputs/agent-performance-telemetry.json",
    "agent-profiles": "data-inputs/agent-profiles.json",
    "agent-profiles-yaml": "data-inputs/agent-profiles-yaml.json",
    "agent-task-logs": "data-inputs/agent-task-logs.json",
    "agent-telemetry-feed": "data-inputs/agent-telemetry-feed.json",
    "api-billing-telemetry": "data-inputs/api-billing-telemetry.json",
    "api-endpoint-registry": "data-inputs/api-endpoint-registry.json",
    "api-usage-telemetry": "data-inputs/api-usage-telemetry.json",
    "audit-log-jsonl": "data-inputs/audit-log-jsonl.json",
    "automation-policy-registry": "data-inputs/automation-policy-registry.json",
    "billing-api-telemetry": "data-inputs/billing-api-telemetry.json",
    "billing-telemetry-feed": "data-inputs/billing-telemetry-feed.json",
    "brand-narrative-md": "data-inputs/brand-narrative-md.json",
    "brand-protocols-md": "data-inputs/brand-protocols-md.json",
    "brand-style-guide-json": "data-inputs/brand-style-guide-json.json",
    "campaign-performance-logs": "data-inputs/campaign-performance-logs.json",
    "channel-management-config-registry": "data-inputs/channel-management-config-registry.json",
    "code-repository": "data-inputs/code-repository.json",
    "competency-framework-md": "data-inputs/competency-framework-md.json",
    "competitor-intelligence-feed": "data-inputs/competitor-intelligence-feed.json",
    "compliance-audit-trail": "data-inputs/compliance-audit-trail.json",
    "compliance-policy-md": "data-inputs/compliance-policy-md.json",
    "compliance-scan-results": "data-inputs/compliance-scan-results.json",
    "content-approval-ledger": "data-inputs/content-approval-ledger.json",
    "crisis-trigger-source": "data-inputs/crisis-trigger-source.json",
    "cultural-manifesto-md": "data-inputs/cultural-manifesto-md.json",
    "customer-feedback-stream": "data-inputs/customer-feedback-stream.json",
    "customer-sentiment-analysis-jsonl": "data-inputs/customer-sentiment-analysis-jsonl.json",
    "decisions": "data-inputs/decisions.json",
    "design-quality-review-log": "data-inputs/design-quality-review-log.json",
    "director-override-key": "data-inputs/director-override-key.json",
    "director-preference-ledger": "data-inputs/director-preference-ledger.json",
    "due-diligence-vault": "data-inputs/due-diligence-vault.json",
    "email-intake-log": "data-inputs/email-intake-log.json",
    "equity-ledger-json": "data-inputs/equity-ledger-json.json",
    "error-stack-trace": "data-inputs/error-stack-trace.json",
    "ethical-guidelines-md": "data-inputs/ethical-guidelines-md.json",
    "external-regulatory-feed": "data-inputs/external-regulatory-feed.json",
    "feature-release-manifest-json": "data-inputs/feature-release-manifest-json.json",
    "financial-ledger-snapshot": "data-inputs/financial-ledger-snapshot.json",
    "fiscal-policy-md": "data-inputs/fiscal-policy-md.json",
    "frontend-commit-manifest": "data-inputs/frontend-commit-manifest.json",
    "frontend-telemetry": "data-inputs/frontend-telemetry.json",
    "funding-roadmap-md": "data-inputs/funding-roadmap-md.json",
    "global-ops-protocol-md": "data-inputs/global-ops-protocol-md.json",
    "google-ecosystem-admin-intelligence-feed": "data-inputs/google-ecosystem-admin-intelligence-feed.json",
    "growth-opex-ledger": "data-inputs/growth-opex-ledger.json",
    "handoff-integrity-log": "data-inputs/handoff-integrity-log.json",
    "idea-origin-ledger": "data-inputs/idea-origin-ledger.json",
    "incident-and-change-log": "data-inputs/incident-and-change-log.json",
    "infrastructure-cost-ledger": "data-inputs/infrastructure-cost-ledger.json",
    "intent-mapping-md": "data-inputs/intent-mapping-md.json",
    "interaction-analyzer-feed": "data-inputs/interaction-analyzer-feed.json",
    "investor-crm-data": "data-inputs/investor-crm-data.json",
    "investor-pipeline-notes": "data-inputs/investor-pipeline-notes.json",
    "kpi-registry-json": "data-inputs/kpi-registry-json.json",
    "lead-velocity-telemetry": "data-inputs/lead-velocity-telemetry.json",
    "marketing-budget-telemetry": "data-inputs/marketing-budget-telemetry.json",
    "model-gateway-config-registry": "data-inputs/model-gateway-config-registry.json",
    "model-gateway-status": "data-inputs/model-gateway-status.json",
    "operational-sops-md": "data-inputs/operational-sops-md.json",
    "pii-regex-library": "data-inputs/pii-regex-library.json",
    "product-usage-events": "data-inputs/product-usage-events.json",
    "queue-bottleneck-telemetry": "data-inputs/queue-bottleneck-telemetry.json",
    "queue-telemetry-feed": "data-inputs/queue-telemetry-feed.json",
    "routing-logic-json": "data-inputs/routing-logic-json.json",
    "sales-activity-log": "data-inputs/sales-activity-log.json",
    "schema-sql": "data-inputs/schema-sql.json",
    "security-baseline-md": "data-inputs/security-baseline-md.json",
    "security-protocols-md": "data-inputs/security-protocols-md.json",
    "service-latency-metrics": "data-inputs/service-latency-metrics.json",
    "sqlite-vault-schema": "data-inputs/sqlite-vault-schema.json",
    "strategic-milestones-json": "data-inputs/strategic-milestones-json.json",
    "strategic-vision-md": "data-inputs/strategic-vision-md.json",
    "system-architecture-md": "data-inputs/system-architecture-md.json",
    "system-health-telemetry": "data-inputs/system-health-telemetry.json",
    "system-latency-logs": "data-inputs/system-latency-logs.json",
    "talent-pipeline-records": "data-inputs/talent-pipeline-records.json",
    "technical-north-star-md": "data-inputs/technical-north-star-md.json",
    "term-sheet-pdf": "data-inputs/term-sheet-pdf.json",
    "u-i-component-library": "data-inputs/u-i-component-library.json",
    "usability-standards-json": "data-inputs/usability-standards-json.json",
    "vault-audit-trail": "data-inputs/vault-audit-trail.json",
    "vault-context-index": "data-inputs/vault-context-index.json",
    "vault-ingest-service": "data-inputs/vault-ingest-service.json",
    "visual-tokens-json": "data-inputs/visual-tokens-json.json",
    "voice-identity-consent-registry": "data-inputs/voice-identity-consent-registry.json",
    "work-order-routing-log": "data-inputs/work-order-routing-log.json"
  },
  "updatedAt": "2026-04-08T00:00:00.000Z"
}
