{
  "$schema": "../../../schemas/metadata-catalog.schema.json",
  "companyId": "bavans-publishing",
  "description": "Workflow references for BAVANS Publishing company",
  "entries": {
    "arya/autonomous-optimization": "workflows/arya/autonomous-optimization.yaml",
    "arya/creative-content-approval-gate": "workflows/arya/creative-content-approval-gate.yaml",
    "arya/crisis-support-mode": "workflows/arya/crisis-support-mode.yaml",
    "arya/human-in-loop-governance": "workflows/arya/human-in-loop-governance.yaml",
    "arya/seed-autonomous-alignment": "workflows/arya/seed-autonomous-alignment.yaml",
    "arya/seed-human-in-loop-escalation": "workflows/arya/seed-human-in-loop-escalation.yaml",
    "arya/sop-autonomous-mode": "workflows/arya/sop-autonomous-mode.yaml",
    "dani/brand-identity-audit": "workflows/dani/brand-identity-audit.yaml",
    "dani/crisis-support-mode": "workflows/dani/crisis-support-mode.yaml",
    "dani/human-in-loop-narrative-pivot": "workflows/dani/human-in-loop-narrative-pivot.yaml",
    "dani/product-launch-orchestration": "workflows/dani/product-launch-orchestration.yaml",
    "dani/seed-autonomous-alignment": "workflows/dani/seed-autonomous-alignment.yaml",
    "dani/seed-human-in-loop-escalation": "workflows/dani/seed-human-in-loop-escalation.yaml",
    "dani/sop-autonomous-growth": "workflows/dani/sop-autonomous-growth.yaml",
    "elina/crisis-stabilization-mode": "workflows/elina/crisis-stabilization-mode.yaml",
    "elina/human-in-loop-bottleneck-resolution": "workflows/elina/human-in-loop-bottleneck-resolution.yaml",
    "elina/operational-improvement-cycle": "workflows/elina/operational-improvement-cycle.yaml",
    "elina/seed-autonomous-alignment": "workflows/elina/seed-autonomous-alignment.yaml",
    "elina/seed-human-in-loop-escalation": "workflows/elina/seed-human-in-loop-escalation.yaml",
    "elina/sop-autonomous-queue-management": "workflows/elina/sop-autonomous-queue-management.yaml",
    "eva/crisis-lockdown-mode": "workflows/eva/crisis-lockdown-mode.yaml",
    "eva/governance-policy-update": "workflows/eva/governance-policy-update.yaml",
    "eva/human-in-loop-risk-resolution": "workflows/eva/human-in-loop-risk-resolution.yaml",
    "eva/seed-autonomous-alignment": "workflows/eva/seed-autonomous-alignment.yaml",
    "eva/seed-human-in-loop-escalation": "workflows/eva/seed-human-in-loop-escalation.yaml",
    "eva/sop-autonomous-compliance-gate": "workflows/eva/sop-autonomous-compliance-gate.yaml",
    "global/google-ecosystem-action-intelligence": "workflows/global/google-ecosystem-action-intelligence.yaml",
    "global/product-campaign-global-collaboration": "workflows/global/product-campaign-global-collaboration.yaml",
    "julia/architectural-evolution": "workflows/julia/architectural-evolution.yaml",
    "julia/human-in-loop-technical-risk": "workflows/julia/human-in-loop-technical-risk.yaml",
    "julia/seed-autonomous-alignment": "workflows/julia/seed-autonomous-alignment.yaml",
    "julia/seed-human-in-loop-escalation": "workflows/julia/seed-human-in-loop-escalation.yaml",
    "julia/self-healing-code-repair": "workflows/julia/self-healing-code-repair.yaml",
    "julia/self-healing-code-repair-goose-protocol": "workflows/julia/self-healing-code-repair-goose-protocol.yaml",
    "julia/sop-autonomous-tech-health": "workflows/julia/sop-autonomous-tech-health.yaml",
    "lina/agentic-expansion-governance": "workflows/lina/agentic-expansion-governance.yaml",
    "lina/friction-resolution-mode": "workflows/lina/friction-resolution-mode.yaml",
    "lina/human-in-loop-talent-pivot": "workflows/lina/human-in-loop-talent-pivot.yaml",
    "lina/seed-autonomous-alignment": "workflows/lina/seed-autonomous-alignment.yaml",
    "lina/seed-human-in-loop-escalation": "workflows/lina/seed-human-in-loop-escalation.yaml",
    "lina/sop-autonomous-calibration": "workflows/lina/sop-autonomous-calibration.yaml",
    "maya/due-diligence-self-healing": "workflows/maya/due-diligence-self-healing.yaml",
    "maya/fundraising-round-orchestration": "workflows/maya/fundraising-round-orchestration.yaml",
    "maya/human-in-loop-equity-pivot": "workflows/maya/human-in-loop-equity-pivot.yaml",
    "maya/seed-autonomous-alignment": "workflows/maya/seed-autonomous-alignment.yaml",
    "maya/seed-human-in-loop-escalation": "workflows/maya/seed-human-in-loop-escalation.yaml",
    "maya/sop-autonomous-pipeline-management": "workflows/maya/sop-autonomous-pipeline-management.yaml",
    "mira/channel-communication-onboarding": "workflows/mira/channel-communication-onboarding.yaml",
    "mira/contextual-self-healing": "workflows/mira/contextual-self-healing.yaml",
    "mira/crisis-command-prioritization": "workflows/mira/crisis-command-prioritization.yaml",
    "mira/email-collaborative-draft": "workflows/mira/email-collaborative-draft.yaml",
    "mira/email-intake-triage": "workflows/mira/email-intake-triage.yaml",
    "mira/feature-onboarding-governance": "workflows/mira/feature-onboarding-governance.yaml",
    "mira/human-in-loop-intent-clarification": "workflows/mira/human-in-loop-intent-clarification.yaml",
    "mira/multi-framework-registry-extraction": "workflows/mira/multi-framework-registry-extraction.yaml",
    "mira/seed-autonomous-alignment": "workflows/mira/seed-autonomous-alignment.yaml",
    "mira/seed-human-in-loop-escalation": "workflows/mira/seed-human-in-loop-escalation.yaml",
    "mira/sop-autonomous-routing": "workflows/mira/sop-autonomous-routing.yaml",
    "nora/crisis-runway-freeze": "workflows/nora/crisis-runway-freeze.yaml",
    "nora/human-in-loop-fiscal-governance": "workflows/nora/human-in-loop-fiscal-governance.yaml",
    "nora/seed-autonomous-alignment": "workflows/nora/seed-autonomous-alignment.yaml",
    "nora/seed-human-in-loop-escalation": "workflows/nora/seed-human-in-loop-escalation.yaml",
    "nora/sop-autonomous-fiscal-monitoring": "workflows/nora/sop-autonomous-fiscal-monitoring.yaml",
    "sofia/human-in-loop-creative-direction": "workflows/sofia/human-in-loop-creative-direction.yaml",
    "sofia/seed-autonomous-alignment": "workflows/sofia/seed-autonomous-alignment.yaml",
    "sofia/seed-human-in-loop-escalation": "workflows/sofia/seed-human-in-loop-escalation.yaml",
    "sofia/self-healing-ux-repair": "workflows/sofia/self-healing-ux-repair.yaml",
    "sofia/self-healing-ux-repair-goose-protocol": "workflows/sofia/self-healing-ux-repair-goose-protocol.yaml",
    "sofia/sop-autonomous-design-audit": "workflows/sofia/sop-autonomous-design-audit.yaml",
    "sofia/visual-identity-evolution": "workflows/sofia/visual-identity-evolution.yaml"
  },
  "updatedAt": "2026-04-08T00:00:00.000Z"
}
